{"note":"OECD real house price index (RHP, 2015=100; already CPI-deflated) and OECD Pensions at a Glance 2024 (gross replacement rate, mandatory schemes, average earner; current normal retirement age). Countries not listed use the OECD median, flagged 推估.","retrieved":"2026-10-16","house":{"CZE":{"from":2008,"v":[109.98,104.699,100.47,99.2528,96.0673,95.4083,96.6156,100,106.058,115.09,121.413,128.713,135.499,155.654,159.333,144.282,146.61,157.141]},"DNK":{"from":1970,"v":[46.2557,48.7248,52.6148,55.5292,50.552,53.897,53.7295,55.6028,59.6863,59.7708,53.9065,45.8865,40.5561,46.1076,49.7091,56.0465,62.1365,55.1721,53.4269,50.675,46.0373,45.3564,44.1759,43.2818,47.3582,50.0251,54.4338,59.6134,64.0076,67.0431,69.4631,71.8624,73.0654,75.7888,83.1346,98.0428,119.012,120.148,110.51,95.9919,96.3772,92.5917,88.0755,90.895,93.7048,100,104.548,108.666,112.928,114.501,119.187,130.518,126.898,118.218,120.58,126.365]},"FIN":{"from":1970,"v":[58.5979,57.1537,57.6166,64.8011,65.3426,58.6356,55.1663,51.1118,48.8327,48.091,49.3221,50.8953,55.1544,61.2649,64.1787,63.4549,63.1389,67.3677,86.0595,102.184,92.6818,78.0133,64.4919,55.9061,57.7988,56.5402,59.3132,67.3661,72.1391,76.1273,76.781,73.6951,76.8531,80.9228,87.2841,93.2051,98.3288,102.159,99.5999,99.1413,103.932,103.794,103.383,102.121,100.46,100,101.131,101.191,100.823,100.266,101.639,104.019,98.6914,88.6663,84.904,81.9053]},"LVA":{"from":2006,"v":[142.452,175.881,155.729,94.9714,86.5708,91.7753,92.4115,98.503,103.602,100,107.74,113.943,121.588,128.182,132.263,142.714,142.279,137.092,139.984,145.436]},"POL":{"from":2005,"v":[68.5369,92.174,134.001,127.789,120.777,113.421,108.567,101.676,96.8156,98.0677,100,102.562,104.557,109.785,116.7,124.696,128.97,126.483,125.598,139.616,141.068]},"SVK":{"from":2005,"v":[80.0979,89.1523,112.053,126.658,110.406,105.272,99.9003,93.9288,93.463,94.8387,100,106.993,112.084,118.181,126.047,135.158,139.355,142.126,128.882,129.805,140.073]},"ESP":{"from":1971,"v":[35.0616,34.5031,37.6234,43.6,40.7827,40.8279,45.1003,50.2767,45.5637,41.2298,38.3931,34.6324,36.8008,35.8067,36.4392,38.3911,51.2246,61.9015,71.6788,77.7509,83.2141,77.5741,73.4401,71.0926,70.1827,70.0315,71.0541,73.3002,76.7882,79.261,83.8062,95.42,110.92,126.814,140.675,154.431,164.109,156.186,147.273,141.91,128.077,106.992,96.29,96.4653,100,104.42,109.232,114.961,119.639,122.253,124.01,124.931,123.613,129.983,143.034]},"SWE":{"from":1970,"v":[41.6689,40.7474,41.1484,41.0402,40.5636,43.1358,45.0082,47.0915,48.0512,49.4134,46.4172,42.4161,38.5702,34.8933,33.3092,32.3872,32.9229,35.2681,39.262,43.7018,44.4865,43.0091,38.0883,32.1264,32.7132,31.8738,31.8146,33.494,36.5162,39.3795,43.4107,45.8728,47.9612,50.1483,54.5738,58.9541,65.7001,72.9633,71.7067,72.4758,77.24,78.1338,78.7289,82.3225,89.3198,100,107.307,112.466,108.691,109.148,112.767,121.515,118.026,104.742,101.795,100.21]},"BGR":{"from":2005,"v":[105.801,118.734,140.565,165.398,130.82,115.465,105.202,100.306,99.5163,99.5986,100,105.243,109.359,113.9,118.272,124.691,127.491,125.439,127.034,140.948,154.156]},"HRV":{"from":2005,"v":[103.856,118.011,132.467,138.897,127.72,117.955,115.52,110.191,103.738,102.515,100,102.165,105.246,110.497,118.891,126.964,132.936,138.033,142.372,151.962,166.826]},"RUS":{"from":2001,"v":[73.1513,79.4284,88.1237,98.9923,106.331,129.366,166.982,174.435,150.193,138.665,113.609,115.779,116.818,111.399,100,96.2378,99.0896,102.338,101.304,117.076,127.627,147.587,154.743,186.72,211.404]},"CHN":{"from":2010,"v":[96.8591,99.0067,95.6753,99.9804,102.704,100,109.876,122.489,127.065,128.317,129.747,133.565,132.233,131.718,133.383,137.014]},"KOR":{"from":1986,"v":[131.145,126.718,138.605,149.124,160.193,159.141,137.375,124.368,111.563,104.704,98.7114,95.8143,81.977,78.9968,76.8047,76.6755,86.651,91.3421,89.0852,88.023,92.3925,99.648,102.075,100.33,100.038,101.154,100.1,97.9024,98.2028,100,100.293,99.5475,99.5209,98.5311,100.882,107.043,104.662,93.9729,92.0605,90.9359]},"HUN":{"from":2007,"v":[126.595,122.55,111.594,105.105,98.2432,89.8209,86.2519,88.857,100,112.321,122.03,134.793,150.926,154.063,169.503,179.866,168.939,181.808,202.282]},"LUX":{"from":2007,"v":[83.7069,84.613,84.0989,86.9383,87.5318,89.3033,92.3407,95.7257,100,105.279,108.822,114.804,124.004,140.665,157.882,163.96,142.394,131.378,130.371]},"ROU":{"from":2009,"v":[159.29,134.666,113.461,103.405,101.669,98.3651,100,105.211,108.711,110.085,110.233,113.814,113.495,109.524,104.677,104.289,102.489]},"GRC":{"from":1997,"v":[83.1475,97.1336,101.61,112.444,126.662,142.2,144.758,143.855,155.396,170.555,174.794,171.199,163.838,150.618,138.332,120.99,109.667,103.949,100,98.4571,97.1734,98.8539,105.921,112.001,119.357,125.505,138.129,147.633,154.522]},"ISR":{"from":1994,"v":[65.3519,68.3354,73.8191,75.5576,74.3358,73.4022,68.8057,65.893,66.226,62.4044,61.699,60.9254,59.8515,58.2805,60.1632,66.7387,76.5448,82.106,83.1679,88.8658,94.1074,100,108.535,112.811,110.983,112.391,116.47,124.482,139.07,136.591,138.827,138.506]},"IRL":{"from":1970,"v":[32.4902,33.3269,33.3837,32.442,33.9458,35.19,35.0254,36.6081,45.3596,49.3086,46.6972,47.3164,44.1866,43.5319,42.3349,40.7817,40.1038,38.7637,40.6663,42.2048,47.079,47.1458,46.6615,46.6149,47.561,49.1865,51.6363,57.7699,69.0468,81.5963,93.9353,102.111,104.671,116.069,127.284,136.011,151.866,158.173,146.598,128.417,112.928,92.6654,79.031,79.0817,90.8479,100,106.469,116.681,126.795,127.457,127.863,134.599,140.963,134.91,141.973,150.061]},"CAN":{"from":1970,"v":[31.0385,31.6673,32.7144,36.9332,42.4946,42.5775,44.1231,42.7095,41.3574,41.8305,42.6324,43.7069,37.7682,37.3259,35.4429,35.8763,40.2628,45.3401,51.5193,55.7737,51.712,51.6272,51.5196,51.4881,52.5339,49.5912,48.8362,49.3518,48.0332,48.7631,49.7842,51.0667,54.0843,57.6219,61.3159,65.099,71.4809,78.4177,81.1484,79.685,85.6834,88.4491,91.4689,92.8087,95.8717,100,109.074,120.421,122.853,122.655,129.661,144.484,151.951,143.337,144.138,139.504]},"EST":{"from":2005,"v":[84.9748,120.455,135.021,113.173,71.763,72.8375,75.0824,77.2777,82.9711,93.7357,100,102.916,103.917,106.295,110.386,118.539,131.199,137.913,134.431,138.417,141.296]},"MEX":{"from":2005,"v":[90.9105,93.8207,94.3259,93.5364,94.2739,90.8464,92.8586,91.3545,93.8884,93.2342,100,101.659,103.759,108.192,114.55,115.565,118.291,118.176,127.501,134.057,141.013]},"NLD":{"from":1970,"v":[41.7027,43.4801,44.2714,45.863,46.7366,47.8298,57.3591,74.9307,78.0122,70.5795,60.6089,51.239,43.3666,42.8995,41.7116,40.7813,42.6378,44.5131,45.8237,48.0564,48.3445,47.8663,50.3199,53.3037,58.3836,61.2945,66.6707,73.0076,79.6545,91.0481,104.608,112.533,115.556,116.908,120.195,122.679,124.433,127.699,127.498,123.179,119.173,113.665,104.912,96.7329,96.6712,100,104.549,110.806,118.651,124.352,131.578,144.346,152.264,139.544,146.751,155.253]},"ITA":{"from":1970,"v":[61.4566,61.6345,61.0662,60.4308,84.5972,80.9346,85.1042,85.0775,86.6336,92.0118,94.2192,109.823,105.86,94.9342,84.303,75.6588,73.6852,75.9797,79.5644,98.2325,112.181,116.642,117.784,112.078,103.612,98.4162,91.4252,85.5304,85.7462,89.0591,93.5455,98.6635,105.056,112.404,120.584,126.931,131.476,135.166,133.253,128.938,126.556,124.661,118.332,109.44,104.088,100,99.7717,97.3511,95.5206,94.5855,96.0502,97.0477,94.3706,91.0236,92.2925,94.6354]},"PRT":{"from":1988,"v":[116.126,121.622,125.4,133.876,137.897,130.657,126.504,123.196,121.735,122.418,124.727,132.64,137.735,139.847,136.007,132.718,130.494,128.535,126.756,123.153,112.24,114.69,113.446,106.028,96.6709,94.0238,97.7826,100,105.974,113.932,123.618,134.71,145.89,156.436,164.264,169.551,179.416,205.712]},"AUS":{"from":1970,"v":[26.1181,27.224,28.6008,31.696,33.6505,31.8506,31.1372,30.5408,29.6145,30.5747,31.3254,33.0159,31.0004,29.9813,31.4296,32.4762,32.1312,31.5305,36.1015,42.3242,40.3799,39.9484,39.8224,40.0258,40.8126,40.1904,39.7251,40.7807,43.1932,45.7986,47.9611,51.5437,59.6179,68.973,72.2469,72.01,74.3294,79.6705,80.248,81.3724,89.0251,85.2326,83.0611,86.5919,92.8804,100,104.854,112.237,108.803,102.542,106.793,122.748,124.42,119.113,122.19,125.893]},"ISL":{"from":2001,"v":[74.7651,74.331,82.1253,87.7625,111.297,121.125,126.496,117.361,91.6688,85.5525,86.3757,87.4225,89.1475,94.0444,100,107.199,128.265,133.33,132.943,136.431,148.697,168.174,168.052,173.608,174.286]},"SVN":{"from":2007,"v":[136.089,137.932,125.202,122.803,123.415,112.641,105.275,98.3972,100,103.734,110.603,117.884,124.046,130.169,140.619,147.138,146.782,154.651,163.09]},"GBR":{"from":1969,"v":[22.4891,22.4495,23.0963,28.8174,36.3963,33.2862,28.5067,26.496,24.6306,26.0118,29.6258,30.6537,28.8314,27.0615,28.6431,29.8457,30.9738,34.0496,38.4476,47.2673,53.5207,49.6778,44.9567,41.6823,40.0918,40.5029,39.5419,39.5866,42.2708,46.4158,51.0853,58.5632,62.8119,72.3362,82.5287,90.5247,94.9561,99.3299,107.581,98.8397,89.1433,93.417,88.6341,87.6169,87.9491,93.9487,100,105.686,108.54,109.863,109.246,111.935,117.781,118.597,111.212,108.806,108.185]},"AUT":{"from":2000,"v":[78.7012,77.536,77.1621,76.2279,73.507,75.3707,76.8376,78.4758,77.7223,80.5047,85.9761,87.8554,91.5441,94.2043,95.9713,100,105.265,108.565,112.617,117.318,124.947,136.6,141.862,127.59,122.784,122.557]},"BEL":{"from":1970,"v":[37.8963,35.7052,36.769,39.609,40.3924,41.4832,46.622,50.6543,54.2726,56.6541,51.5931,45.4225,40.8263,37.513,36.247,35.0339,36.5317,38.2346,40.8331,44.7807,48.2107,48.8852,51.2025,52.584,54.7181,56.3214,57.1816,57.7305,60.7135,64.7805,66.0599,67.6803,71.2708,75.0612,79.5858,86.406,92.3374,96.9091,98.0168,98.2,98.6761,99.5592,99.6497,100.117,98.9902,100,100.832,102.324,103.283,105.601,109.131,113.446,108.269,104.175,105.708,106.631]},"CHL":{"from":2002,"v":[54.9897,56.0207,59.1682,60.4015,62.0111,64.6194,65.186,66.7465,69.6977,75.7802,81.5958,87.5745,93.4088,100,102.869,108.579,117.37,124.949,126.553,135.491,130.684,131.605,134.511,137.448]},"COL":{"from":1988,"v":[71.6882,75.8796,74.7527,70.0342,65.8636,66.6195,75.1083,81.6828,82.4561,77.6807,73.3263,64.8062,58.6543,56.987,53.7945,51.5904,53.2864,55.4956,59.1769,65.5543,72.046,76.2728,80.1198,82.0518,87.0324,93.2061,97.6333,100,102.436,105.2